,Company,Valuation ($B),Date Joined,Country,City,Industry,Select Investors
843,Acko General Insurance,$1.1,10/28/2021,India,Bengaluru,Fintech,"Intact Ventures, Munich Re Ventures, General Atlantic"
844,Daily Harvest,$1.1,11/16/2021,United States,New York,E-commerce & direct-to-consumer,"M13, Lightspeed Venture Partners, Lone Pine Capital"
845,The Bank of London,$1.1,11/30/2021,United Kingdom,London,Fintech,"Mangrove Capital Partners,14W. ForgeLight"
846,Fundbox,$1.1,11/30/2021,United States,San Francisco,Fintech,"Khosla Ventures, General Catalyst, Blumberg Capital"
847,Turing,$1.1,12/20/2021,United States,Palo Alto,Internet software & services,"Foundation Capital, Frontier Ventures, AltaIR Capital"
848,GlobalBees,$1.1,12/28/2021,India,New Delhi,E-commerce & direct-to-consumer,"Chiratae Ventures, SoftBank Group, Trifecta Capital"
849,LEAD School,$1.1,1/13/2022,India,Andheri,Edtech,"WestBridge Capital, GSV Ventures, Elevar Equity"
850,eSentire,$1.1,2/22/2022,Canada,Waterloo,Cybersecurity,"Edison Partners, Georgian Partners, VentureLink"
851,Beyond Identity,$1.1,2/22/2022,United States,New York,Cybersecurity,"New Enterprise Associates, Koch Disruptive Technologies, Evolution Equity Partners"
852,Staffbase,$1.1,3/15/2022,Germany,Chemnitz,Internet software & services,"Insight Partners, e.ventures, General Atlantic"
853,Chief,$1.1,3/31/2022,United States,New York,Other,"General Catalyst, Inspired Capital, Flybridge Capital Partners"
854,IntelyCare,$1.1,4/6/2022,United States,Quincy,Health,"Kaiser Permanente Ventures, Endeavour Vision, LRVHealth"
855,Teleport,$1.1,5/3/2022,United States,Oakland,Cybersecurity,"Kleiner Perkins Caufield & Byers, s28 Capital, Insight Partners"
856,Imply Data,$1.1,5/17/2022,United States,Burlingame,Data management & analytics,"Andreessen Horowitz, Bessemer Venture Partners, Khosla Ventures,"
857,Material Security,$1.1,5/11/2022,United States,Redwood City,Cybersecurity,"Andreessen Horowitz, Founders Fund"
858,PhysicsWallah,$1.1,6/7/2022,India,Uttar Pradesh,Edtech,"GSV Ventures, WestBridge Capital"
859,Recover,$1.1,6/9/2022,Spain,Banyeres de Mariola,Other,"Goldman Sachs Asset Management, STORY3 Capital Partners"
860,Purplle,$1.1,6/9/2022,India,Mumbai,E-commerce & direct-to-consumer,"Blume Ventures, JSW Ventures, IvyCap Ventures"
861,Nxin,$1.08,9/18/2018,China,Beijing,Internet software & services,"Beijing Juneng Hesheng Industry Investment Fund, Beijing Shuju Xinrong Fund"
862,UISEE Technology,$1.08,1/25/2021,China,Beijing,"Supply chain, logistics, & delivery","Shenzhen Capital Group, Robert Bosch Venture Capital, SeptWolves Ventures"
863,56PINGTAI,$1.08,1/25/2021,China,Shanghai,"Supply chain, logistics, & delivery","QF Capital, QC Capital, Unicom Innovation Venture Capital"
864,Cirkul,$1.07,6/13/2022,United States,Sarasota,Consumer & retail,"AF Ventures, Siddhi Capital, SC.Holdings"
865,Rubicon,$1.07,8/25/2017,United States,Atlanta,Other,"Goldman Sachs, Leonardo DiCaprio, Promecap"
866,Radius Payment Solutions,$1.07,11/27/2017,United Kingdom,Crewe,Fintech,Inflexion Private Equity
867,Rivigo,$1.07,7/11/2019,India,Gurgaon,"Supply chain, logistics, & delivery","SAIF Partners India, Warburg Pincus, Trifecta Capital Advisors"
868,Mamaearth,$1.07,12/28/2021,India,Gurgaon,E-commerce & direct-to-consumer,"Fireside Ventures, Sequoia Capital India, Stellaris Venture Partners"
869,0x,$1.05,4/26/2022,United States,San Francisco,Fintech,"Jump Capital, Pantera Capital, Greylock Partners"
870,Jiuxian,$1.05,7/30/2015,China,Beijing,E-commerce & direct-to-consumer,"Sequoia Capital China, Rich Land Capital, Merrysunny Wealth"
871,Instabase,$1.05,10/21/2019,United States,San Francisco,Data management & analytics,"New Enterprise Associates, Greylock Partners, Andreessen Horowitz"
872,Sendbird,$1.05,4/6/2021,United States,San Mateo,Mobile & telecommunications,"FundersClub, Y Combinator, Tiger Global Management"
873,Density,$1.05,11/10/2021,United States,San Francisco,Hardware,"Founders Fund, Upfront Ventures, 01 Advisors"
874,Mixpanel,$1.05,11/15/2021,United States,San Francisco,Internet software & services,"Bain Capital Tech Opportunities, Andreessen Horowitz, Sequoia Capital"
875,Aprogen,$1.04,5/31/2019,South Korea,Seongnam-Si,Health,"Lindeman Asia Investment, Nichi-Iko Pharmaceutical"
876,OrCam Technologies,$1.03,2/20/2018,Israel,Jerusalem,Artificial intelligence,"Intel Capital, Aviv Venture Capital"
877,Ample,$1.02,11/11/2021,United States,San Francisco,Hardware,"Shell Ventures, Blackstone, Moore Strategic Ventures"
878,Leap Motor,$1.01,11/20/2018,China,Hangzhou,Auto & transportation,"Sequoia Capital China, Gopher Asset Management, Shanghai Electric Group"
879,Wheel,$1.01,1/19/2022,United States,Austin,Health,"Silverton Partners, Tusk Ventures, CRV"
880,TransferMate,$1,5/22/2022,Ireland,Kilkenny,Fintech,Railway Pension Trustee Co. Ltd.
881,Lookout,$1,10/10/2013,United States,San Francisco,Cybersecurity,"Accel Partners, Greylock Partners, Lowercase Capital"
882,Perimeter 81,$1,6/6/2022,Israel,Tel Aviv,Cybersecurity,"Insight Partners, Toba Capital, Spring Ventures"
883,Snapdeal,$1,5/21/2014,India,New Delhi,E-commerce & direct-to-consumer,"SoftBankGroup, Blackrock, Alibaba Group"
884,TechStyle Fashion Group,$1,8/29/2014,United States,El Segundo,E-commerce & direct-to-consumer,"Matrix Partners, Passport Capital, Rho Ventures"
885,InMobi,$1,12/2/2014,India,Bengaluru,Mobile & telecommunications,"Kleiner Perkins Caufield & Byers, Softbank Corp., Sherpalo Ventures"
886,LinkSure Network,$1,1/1/2015,China,Shanghai,Mobile & telecommunications,
887,Red Ventures,$1,1/7/2015,United States,Fort Mill,Other,"Silver Lake Partners, General Atlantic"
888,BeiBei,$1,1/22/2015,China,Hangzhou,E-commerce & direct-to-consumer,"Banyan Capital, New Horizon Capital, IDG Capital Partners"
889,Lamabang,$1,3/6/2015,China,Shenzhen,E-commerce & direct-to-consumer,"5Y Capital, Matrix Partners China, K2VC"
890,JimuBox,$1,4/21/2015,China,Beijing,Fintech,"Matrix Partners China, Ventech China, Shunwei Capital Partners"
891,FXiaoKe,$1,7/2/2015,China,Beijing,Mobile & telecommunications,"IDG Capital, Northern Light Venture Capital, DCM Ventures"
892,Vox Media,$1,8/12/2015,United States,Washington,Internet software & services,"Accel Partners, Comcast Ventures, General Atlantic"
893,Mia.com,$1,9/8/2015,China,Beijing,E-commerce & direct-to-consumer,"Sequoia Capital China, ZhenFund, K2 Ventures"
894,58 Daojia,$1,10/12/2015,China,Beijing,Internet software & services,"KKR, Alibaba Group, Ping An Insurance"
895,Womai,$1,10/12/2015,China,Beijing,E-commerce & direct-to-consumer,"SAIF Partners China, Baidu, IDG Capital"
896,HuJiang,$1,10/29/2015,China,Shanghai,Edtech,"China Minsheng Investment, Baidu, Wanxin Media"
897,iTutorGroup,$1,11/18/2015,China,Shanghai,Edtech,"QiMing Venture Partners, Temasek Holdings, Silverlink Capital"
898,MindMaze,$1,1/28/2016,Switzerland,Lausanne,Health,Hinduja Group
899,iCarbonX,$1,4/12/2016,China,Shenzhen,Artificial intelligence,"Tencent, Vcanbio"
900,SMS Assist,$1,6/7/2016,United States,Chicago,Internet software & services,"Goldman Sachs, Insights Venture Partners, Pritzker Group Venture Capital"
901,Kendra Scott,$1,12/21/2016,United States,Austin,Consumer & retail,"Berkshire Partners, Norwest Venture Partners"
902,Mobvoi,$1,4/6/2017,China,Beijing,Consumer & retail,"Sequoia Capital China, SIG Asia Investments, ZhenFund"
903,Zhuan Zhuan,$1,4/18/2017,China,Beijing,E-commerce & direct-to-consumer,"58.com, Tencent Holdings"
904,Modernizing Medicine,$1,5/10/2017,United States,Boca Raton,Health,"Warburg Pincus, Summit Partners, Sands Capital"
905,Zhaogang,$1,6/29/2017,China,Shanghai,E-commerce & direct-to-consumer,"K2 Ventures, Matrix Partners China, IDG Capital"
906,DianRong,$1,8/2/2017,China,Shanghai,E-commerce & direct-to-consumer,"Standard Chartered, FinSight Ventures, Affirma Capital"
907,Cell C,$1,8/7/2017,South Africa,Midrand,Mobile & telecommunications,"Blue Label Telecoms, Net1 UEPS Technologies"
908,YH Global,$1,9/21/2017,China,Shenzhen,"Supply chain, logistics, & delivery","Co-Energy Finance, Grandland"
909,Revolution Precrafted,$1,10/23/2017,Philippines,Manila,Other,"K2 Global, 500 Startups"
910,WeLab,$1,11/8/2017,Hong Kong,,Fintech,"Sequoia Capital China, ING, Alibaba Entrepreneurs Fund"
911,Maimai,$1,11/15/2017,China,Beijing,Mobile & telecommunications,"Morningside Venture Capital, IDG Capital, DCM Ventures"
912,Dxy.cn,$1,4/10/2018,China,Hangzhou,Health,"Tencent Holdings, DCM Ventures"
913,Orbbec Technology,$1,5/21/2018,China,Shenzhen,Hardware,"R-Z Capital, Green Pine Capital Partners, SAIF Partners China"
914,HMD Global,$1,5/21/2018,Finland,Espoo,Mobile & telecommunications,Ginko Ventures
915,Huike Group,$1,5/24/2018,China,Beijing,Edtech,"Fosun RZ Capital, Oceanwide Holdings, Shenzhen Qianhe Capital Management Co."
916,China Cloud,$1,6/11/2018,China,Wuxi,Hardware,"V Star Capital, GF Xinde Investment Management Co., Haitong Leading Capital Management"
917,LinkDoc Technology,$1,7/5/2018,China,Beijing,Health,"China Investment Corporation, New Enterprise Associates"
918,MediaMath,$1,7/10/2018,United States,New York,Internet software & services,"Silicon Valley Bank, QED Investors, European Founders Fund"
919,Movile,$1,7/12/2018,Brazil,Sao Paulo,Mobile & telecommunications,"Innova Capital - FIP, 3G Capital Management, Prosus Ventures"
920,Kuaigou Dache,$1,7/13/2018,China,Tianjin,"Supply chain, logistics, & delivery","Sequoia Capital China, InnoVision Capital, Qianhai Fund of Funds"
921,Pat McGrath Labs,$1,7/16/2018,United States,New York,Consumer & retail,"One Luxury Group, Eurazeo"
922,Wacai,$1,7/18/2018,China,Hangzhou,Mobile & telecommunications,"Qiming Venture Partners, China Broadband Capital, CDH Investments"
923,FlashEx,$1,8/27/2018,China,Beijing,"Supply chain, logistics, & delivery","Prometheus Capital, Matrix Partners China, JD Capital Management"
924,Banma Network Technologies,$1,9/13/2018,China,Shanghai,Auto & transportation,"Yunfeng Capital, SDIC Innovation Investment Management, Shang Qi Capital"
925,Tresata,$1,10/10/2018,United States,Charlotte,Fintech,GCP Capital Partners
926,Momenta,$1,10/17/2018,China,Beijing,Artificial intelligence,"Sinovation Ventures, Tencent Holdings, Sequoia Capital China"
927,Hosjoy,$1,10/18/2018,China,Nanjing,E-commerce & direct-to-consumer,"U.S.-China Green Fund, Founder H Fund, Richland Equities"
928,Omio,$1,10/23/2018,Germany,Berlin,Travel,"Lakestar, Battery Ventures, New Enterprise Associates"
929,TERMINUS Technology,$1,10/25/2018,China,Beijing,Hardware,"China Everbright Limited, IDG Capital, iFLYTEK"
930,BitFury,$1,11/6/2018,Netherlands,Amsterdam,Hardware,"Georgian Co-Investment Fund, iTech Capital, Galaxy Digital"
931,iFood,$1,11/13/2018,Brazil,Osasco,"Supply chain, logistics, & delivery","Movile, Just Eat, Naspers"
932,Geek+,$1,11/21/2018,China,Beijing,Hardware,"Volcanics Ventures, Vertex Ventures China, Warburg Pincus"
933,REEF Technology,$1,12/10/2018,United States,Miami,"Supply chain, logistics, & delivery","Target Global, UBS Asset Management, Mubadala Capital"
934,Globality,$1,1/22/2019,United States,Menlo Park,Artificial intelligence,SoftBank Group
935,Ynsect,$1,2/21/2019,France,Evry,Other,"Astanor Ventures, Upfront Ventures, IDInvest Partners"
936,Intellifusion,$1,3/22/2019,China,Shenzhen,Artificial intelligence,"BOC International, TopoScend Capital, Hongxiu VC"
937,Poizon,$1,4/29/2019,China,Shanghai,Mobile & telecommunications,"DST Global, Sequoia Capital China, Gaorong Capital"
938,VTS,$1,5/7/2019,United States,New York,Internet software & services,"Trinity Ventures, Fifth Wall Ventures, OpenView Venture Partners"
939,SITECH DEV,$1,5/16/2019,China,Guiyang,Other,China Prosperity Capital
940,KnowBox,$1,5/30/2019,China,Beijing,Edtech,"TAL Education Group, Legend Star, Alibaba Group"
941,Yanolja,$1,6/10/2019,South Korea,Seoul,Travel,"SBI Investment Korea, Partners Investment, GIC"
942,Meero,$1,6/18/2019,France,Paris,Artificial intelligence,"Aglae Ventures, Global Founders Capital, Alven Capital"
943,SumUp,$1,7/16/2019,United Kingdom,London,Fintech,"American Express Ventures, Goldman Sachs, Bain Capital Credit"
944,Ibotta,$1,8/6/2019,United States,Denver,Fintech,"Koch Disruptive Technologies, Teamworthy Ventures, GGV Capital"
945,C2FO,$1,8/7/2019,United States,Leawood,Fintech,"Union Square Ventures, Summerhill Venture Partners, Mithril Capital Management"
946,Numbrs,$1,8/22/2019,Switzerland,Zurich,Fintech,"Investment Corporation of Dubai, Centralway"
947,EBANX,$1,10/16/2019,Brazil,Curitiba,Fintech,"FTV Capital, Endeavor"
948,KK Group,$3,10/23/2019,China,Dongguan,E-commerce & direct-to-consumer,"Matrix Partners China, Bright Venture Capita, Shenzhen Capital Group"
949,Alto Pharmacy,$1,1/30/2020,United States,San Francisco,Health,"Jackson Square Ventures, Greenoaks Capital Management, Softbank Group"
950,Hotmart,$1,3/17/2020,Netherlands,Amsterdam,E-commerce & direct-to-consumer,"Technology Crossover Ventures, Alkeon Capital Management, General Atlantic"
951,Emerging Markets Property Group,$1,4/28/2020,United Arab Emirates,Dubai,Other,"OLX Group, KCK Group, EXOR Seeds"
952,Quizlet,$1,5/13/2020,United States,San Francisco,Edtech,"Union Square Ventures, Altos Ventures, Costanoa Ventures"
953,Orca Bio,$1,6/17/2020,United States,Menlo Park,Health,"Lightspeed Venture Partners, Data Collective, 8VC"
954,Newlink Group,$1,7/10/2020,China,Beijing,E-commerce & direct-to-consumer,"JOY Capital, NIO Capital, Blueflame Capital"
955,Infobip,$1,7/30/2020,Croatia,Vodnjan,Mobile & telecommunications,One Equity Partners
956,Zwift,$1,9/16/2020,United States,Long Beach,E-commerce & direct-to-consumer,"Novator Partners, True, Causeway Media Partners"
957,Playco,$1,9/21/2020,Japan,Tokyo,Other,"Sozo Ventures, Caffeinated Capital, Sequoia Capital"
958,Socar,$1.07,10/16/2020,South Korea,Jeju-do,Auto & transportation,"Bain Capital, Altos Ventures, Songhyun Investment"
959,Gousto,$1.7,11/3/2020,United Kingdom,London,"Supply chain, logistics, & delivery","MMC Ventures, BGF Ventures, Unilever Ventures"
960,Boom Supersonic,$1,12/16/2020,United States,Englewood,Other,"WRVI Capital, Caffeinated Capital, Y Combinator"
961,Quantum Metric,$1,1/7/2021,United States,Colorado Springs,Data management & analytics,"Insight Partners, Bain Capital Ventures"
962,News Break,$1,1/7/2021,United States,Mountain View,Internet software & services,"IDG Capital, Francisco Partners, ZhenFund"
963,MadeiraMadeira,$1,1/7/2021,Brazil,Parana,E-commerce & direct-to-consumer,"Flybridge Capital Partners, SoftBank Group, Monashees+"
964,PPRO,$1,1/19/2021,United Kingdom,London,Fintech,"Wellington Management, Eurazeo, Citi Ventures"
965,Splashtop,$1,1/27/2021,United States,San Jose,Internet software & services,"Storm Ventures, DFJ DragonFund, New Enterprise Associates"
966,DriveNets,$1,1/27/2021,Israel,Ra'anana,Internet software & services,"Bessemer Venture Partners, Pitango Venture Capital, D1 Capital Partners"
967,Flash Express,$1,2/1/2021,Thailand,Bangkok,"Supply chain, logistics, & delivery","SCB 10X, Krungsri Finnovate, eWTP Capital"
968,Axiom Space,$1,2/16/2021,United States,Houston,Other,"C5 Capital, Hemisphere Ventures, The Venture Collective"
969,Locus Robotics,$1,2/17/2021,United States,Wilmington,Hardware,"Scale Venture Partners, Bond, Tiger Global Management"
970,Standard,$1,2/17/2021,United States,San Francisco,Artificial intelligence,"CRV, Y Combinator, Initialized Capital"
971,WeBull,$1,2/18/2021,China,Changsha,Fintech,"Bojiang Capital, Hongdao Capital, Mobai Capital"
972,Skydio,$1,2/25/2021,United States,Redwood City,"Supply chain, logistics, & delivery","Andreessen Horowitz, Andreessen Horowitz, Institutional Venture Partners, Accel"
973,Newsela,$1,2/25/2021,United States,New York,Internet software & services,"Owl Ventures, Technology Crossover Ventures, Tao Capital Partners"
974,Aqua Security,$1,3/10/2021,Israel,Ramat Gan,Cybersecurity,"TLV Partners, Lightspeed Venture Partners, M12"
975,PatSnap,$1,3/16/2021,Singapore,,Internet software & services,"Sequoia Capital China, Shunwei Capital Partners, Qualgro"
976,Evidation,$1,3/22/2021,United States,San Mateo,Health,"B Capital Group,, GE Ventures, McKesson Ventures"
977,Sidecar Health,$1,1/26/2021,United States,El Segundo,Fintech,"GreatPoint Ventures, Tiger Global Management, Menlo Ventures"
978,Feedzai,$1,3/24/2021,United States,San Mateo,Artificial intelligence,"Global Founders Capital, Shea Ventures, Greycroft"
979,Yunxuetang,$1,3/29/2021,China,Suzhou,Edtech,"Matrix Partners China, Sequoia Capital China, Hundreds Capital"
980,Cameo,$1,3/30/2021,United States,Chicago,Internet software & services,"Lightspeed Venture Partners, Kleiner Perkins Caufield & Byers, Origin Ventures"
981,Hyperchain,$1,4/11/2021,China,Hangzhou,Fintech,"Yinhong Equity Investment Fund, E Fund, Ideal International"
982,The Zebra,$1,4/12/2021,United States,Austin,E-commerce & direct-to-consumer,"Silverton Partners, Accel, Ballast Point Ventures"
983,Clearcover,$1,4/13/2021,United States,Chicago,Fintech,"American Family Ventures, Cox Enterprises, OMERS Ventures"
984,Groq,$1,4/14/2021,United States,Mountain View,Artificial intelligence,"TDK Ventures, Social Capital, D1 Capital Partners"
985,Fiture,$1,4/14/2021,China,Chengdu,Health,"Bertelsmann Asia Investments, Sequoia Capital China, NIO Capital"
986,Injective Protocol,$1,4/20/2021,United States,New York,Fintech,"Pantera Capital, Cadenza Ventures, BlockTower Capital"
987,Sift,$1,4/22/2021,United States,San Francisco,Artificial intelligence,"Union Square Ventures, Insight Partners, Spark Capital"
988,SaltPay,$1,4/9/2021,United Kingdom,London,Fintech,"Tiger Global Management, Hedosophia"
989,Capsule,$1,4/28/2021,United States,New York,Health,"Thrive Capital, Durable Capital Partners, G Squared"
990,MOLOCO,$1.5,4/29/2021,United States,Redwood City,Artificial intelligence,"Smilegate Investment, DSC Investments, KTB Ventures"
991,Mux,$1,4/30/2021,United States,San Francisco,Internet software & services,"Accel, Cobalt Capital, Andreessen Horowitz"
992,XForcePlus,$1,6/1/2021,China,Shanghai,Internet software & services,"Eastern Bell Capital, Danhua Capital, MSA Capital"
993,Firefly Aerospace,$1.1,5/4/2021,United States,Cedar Park,Other,"XBTO Ventures, Raven One Ventures, SK Ventures"
994,Shift Technology,$1,5/6/2021,France,Paris,Artificial intelligence,"Griffin Gaming Partners, Andreessen Horowitz, Battery Ventures"
995,TensTorrent,$1,5/5/2021,Canada,Toronto,Artificial intelligence,"Eclipse Ventures, Fidelity Investments, Moore Capital Management"
996,Zihaiguo,$1,5/6/2021,China,Chongqing,Consumer & retail,"Xingwang Investment Management, China Capital Investment Group, Matrix Partners China"
997,Forte Labs,$1.73,5/12/2021,United States,San Francisco,Fintech,"Iris Capital, Accel, Elaia Partners"
998,Axtria,$1,5/13/2021,United States,Berkeley Heights,Data management & analytics,"Helion Venture Partners, Bain Capital Tech Opportunities, Sequoia Capital India"
999,Amount,$1,5/17/2021,United States,Chicago,Fintech,"Invus Group, Hanaco Venture Capital, WestCap Group"
1000,Vise,$1,5/18/2021,United States,New York,Fintech,"Sequoia Capital, Founders Fund, Bling Capital"
1001,Printful,$1,5/24/2021,United States,Charlotte,Other,Bregal Sagemount
1002,Matrixport,$1.05,6/1/2021,Singapore,,Fintech,"Dragonfly Captial, Qiming Venture Partners, DST Global"
1003,Shippo,$1,6/2/2021,United States,San Francisco,"Supply chain, logistics, & delivery","Version One Ventures, Uncork Capital, Bessemer Venture Partners"
1004,Thirty Madison,$1,6/2/2021,United States,New York,Health,"Northzone Ventures, Maveron, Johnson & Johnson Innovation"
1005,LetsGetChecked,$1,6/7/2021,Ireland,Dublin,Health,"Optum Ventures, Qiming Venture Partners, Transformation Capital"
1006,EcoFlow,$1,6/10/2021,China,Shenzhen,Hardware,"Delian Capital, China International Capital Corporation, Sequoia Capital China"
1007,Carro,$1,6/14/2021,Singapore,,E-commerce & direct-to-consumer,"SingTel Innov8, Alpha JWC Ventures, Golden Gate Ventures"
1008,Tractable,$1,6/16/2021,United Kingdom,London,Artificial intelligence,"Insight Partners, Ignition Partners, Georgian Partners"
1009,Xiaoe Tech,$1,6/15/2021,China,Shenzhen,Internet software & services,"GGV Capital, Hillhouse Capital Management, IDG Capital"
1010,Bringg,$1,6/16/2021,Israel,Tel Aviv,"Supply chain, logistics, & delivery","Salesforce Ventures, next47, Pereg Ventures"
1011,Claroty,$1,6/17/2021,United States,New York,Cybersecurity,"Bessemer Venture Partners, MoreVC, Team8"
1012,JoyTunes,$1,6/21/2021,Israel,Tel Aviv,Edtech,"Genesis Partners, Aleph, Insight Partners"
1013,Aircall,$1,6/23/2021,United States,New York,Internet software & services,"Balderton Capital, Next World Capital, Draper Esprit"
1014,Worldcoin,$1,6/29/2021,United States,San Francisco,Fintech,"Day One Ventures, Coinbase Ventures, Andreessen Horowitz"
1015,SmartAsset,$1,6/24/2021,United States,New York,Fintech,"Javelin Venture Partners, TTV Capital, Peterson Ventures"
1016,Morning Consult,$1,6/8/2021,United States,Washington DC,Internet software & services,"Advance Venture Partners, Susquehanna Growth Equity, Lupa Systems"
1017,Visier,$1,6/29/2021,Canada,Vancouver,Internet software & services,"Foundation Capital, Summit Partners, Adams Street Partners"
1018,ShipBob,$1,6/29/2021,United States,Chicago,"Supply chain, logistics, & delivery","Hyde Park Venture Partners,	FundersClub. Bain Capital Ventures"
1019,bolttech,$1,7/1/2021,Singapore,,Fintech,"Mundi Ventures, Doqling Capital Partners, Activant Capital"
1020,MobileCoin,$1.06,7/7/2021,United States,San Francisco,Fintech,"General Catalyst, Future Ventures, AU21"
1021,Amperity,$1,7/13/2021,United States,Seattle,Artificial intelligence,"Madrona Venture Group, Tiger Global Management, Madera Technology Partners"
1022,Pantheon Systems,$1,7/13/2021,United States,San Francisco,Internet software & services,"Foundry Group, Scale Venture Partners, SoftBank Group"
1023,Xiaobing,$1,7/12/2021,China,Beijing,Fintech,"NetEase Capital, Northern Light Venture Capital, Microsoft"
1024,dMed Biopharmaceutical,$1,7/12/2021,China,Shanghai,Health,"Qiming Venture Partners, Vivo Capital, Sequoia Capital China"
1025,Carson Group,$1,7/14/2021,United States,Lincoln,Fintech,Bain Capital
1026,GO1,$1,7/19/2021,Australia,Brisbane,Internet software & services,"Y Combinator, M12, SEEK"
1027,Interos,$1,7/22/2021,United States,Arlington,Fintech,"Kleiner Perkins Caufield & Byers, NightDragon Security, Venrock"
1028,BlackBuck,$1,7/22/2021,India,Bengaluru,"Supply chain, logistics, & delivery","Accel, Sands Capital, International Finance Corporation"
1029,NIUM,$1,7/13/2021,Singapore,,Fintech,"Vertex Ventures SE Asia, Global Founders Capital, Visa Ventures"
1030,Human Interest,$1,8/4/2021,United States,San Francisco,Fintech,"Wing Venture Capital, Slow Ventures, Uncork Capital"
1031,Bluecore,$1,8/5/2021,United States,New York,Artificial intelligence,"FirstMark Capital, Georgian Partners, Norwest Venture Partners"
1032,Freshbooks,$1,8/10/2021,Canada,Toronto,Fintech,"Accomplice, Oak Investment Partners, Georgian Partners"
1033,Snorkel AI,$1,8/9/2021,United States,Palo Alto,Artificial intelligence,"Greylock Partners, Google Ventures, BlackRock"
1034,Gelato,$1,8/16/2021,Norway,Oslo,E-commerce & direct-to-consumer,"Greylock Partners, Google Ventures, BlackRock"
1035,Maven Clinic,$1,8/17/2021,United States,New York,Health,"Female Founders Fund, Oak HC/FT Partners, Sequoia Capital"
1036,Dunamu,$1,7/22/2021,South Korea,Seoul,Fintech,"Qualcomm Ventures, Woori Investment, Hanwha Investment & Securities"
1037,Shield AI,$1,8/24/2021,United States,San Diego,Artificial intelligence,"Andreessen Horowitz, Homebrew, Point72 Ventures"
1038,PicsArt,$1,8/26/2021,United States,San Francisco,Mobile & telecommunications,"Sequoia Capital, DCM Ventures, Insight Partners"
1039,1KMXC,$1,8/30/2021,China,Hangzhou,Hardware,"Goldman Sachs Asset Management, SDP Investment, Alibaba Group"
1040,Cider,$1,9/2/2021,Hong Kong,,E-commerce & direct-to-consumer,"Andreessen Horowitz, DST Global, IDG Capital"
1041,Berlin Brands Group,$1,9/1/2021,Germany,Berlin,E-commerce & direct-to-consumer,"Ardian, Bain Capital"
1042,Agile Robots,$1,9/9/2021,Germany,Munich,Hardware,"Hillhouse Capital Management, Sequoia Capital China, Linear Venture"
1043,GrubMarket,$1.2,9/14/2021,United States,San Francisco,E-commerce & direct-to-consumer,"GGV Capital, BlackRock, ACE & Company"
1044,Mammoth Biosciences,$1,9/9/2021,United States,Brisbane,Health,"NFX, Plum Alley, Mayfield"
1045,Orchard,$1,9/9/2021,United States,New York,Fintech,"Accomplice, Juxtapose, FirstMark Capital"
1046,Xendit,$1,9/14/2021,Indonesia,Jakarta,Fintech,"Accel, Y Combinator, Amasia"
1047,TrueLayer,$1,9/21/2021,United Kingdom,London,Fintech,"Anthemis, Connect Ventures, Northzone Ventures"
1048,Assembly,$1,9/21/2021,United States,Culver City,Internet software & services,"Advent International, PSG, Providence Equity Partners"
1049,PandaDoc,$1,9/22/2021,United States,San Francisco,Internet software & services,"Rembrandt Venture Partners, M12, Altos Ventures"
1050,Keenon Robotics,$1,9/15/2021,China,Shanghai,"Supply chain, logistics, & delivery","Yunqi Partners, SoftBank Group, iVision Ventures"
1051,HAYDON,$1,9/24/2021,China,Shanghai,Consumer & retail,"Tencent Holdings, Hillhouse Capital Management"
1052,Ninja Van,$1,9/27/2021,Singapore,,"Supply chain, logistics, & delivery","B Capital Group, Monk's Hill Ventures, Dynamic Parcel Distribution"
1053,Vedantu,$1,9/29/2021,India,Bengaluru,Edtech,"Accel, Tiger Global Management, Omidyar Network"
1054,TrialSpark,$1,9/30/2021,United States,New York,Health,"Sequoia Capital, Thrive Capital, Sound Ventures"
1055,Ajaib,$1,10/4/2021,Indonesia,Jakarta,Fintech,"Softbank Ventures Asia, Alpha JWC Ventures, Insignia Ventures Partners"
1056,Licious,$1,10/5/2021,India,Bengaluru,E-commerce & direct-to-consumer,"3one4 Capital Partners, Bertelsmann India Investments, Vertex Ventures SE Asia"
1057,Masterworks,$1,10/5/2021,United States,New York,Fintech,"Left Lane Capital, Galaxy Interactive, Tru Arrow Partners"
