,Company,Valuation ($B),Date Joined,Country,City,Industry,Select Investors
423,Medable,$2.1,10/26/2021,United States,Palo Alto,Internet software & services,"GSR Ventures, Sapphire Ventures, Streamlined Ventures"
424,GoCardless,$2.1,2/8/2022,United Kingdom,London,Fintech,"Accel, Passion Capital, Balderton Capital"
425,Forto,$2.1,6/21/2021,Germany,Berlin,"Supply chain, logistics, & delivery","Cherry Ventures, Northzone Ventures, Global Founders Capital"
426,Jeeves,$2.1,3/14/2022,United States,Orlando,Fintech,"Tencent Holdings, CRV, Clocktower Technology Ventures"
427,Babel Finance,$2,5/25/2022,Hong Kong,Hong Kong,Fintech,"Dragonfly Capital, BAI Capital, 10T Fund"
428,Trendy Group International,$2,2/13/2012,Hong Kong,Kowloon,Consumer & retail,L Capital Partners
429,Avant,$2,12/17/2012,United States,Chicago,Artificial intelligence,"RRE Ventures, Tiger Global, August Capital"
430,Tubatu.com,$2,3/9/2015,China,Shenzhen,E-commerce & direct-to-consumer,"Sequoia Capital China, Matrix Partners China, 58.com"
431,BlaBlaCar,$2,9/16/2015,France,Paris,Auto & transportation,"Accel Partners, Index Ventures, Insight Venture Partners"
432,HuiMin,$2,9/5/2016,China,Beijing,E-commerce & direct-to-consumer,"Zheshang Venture Capital, GP Capital, Western Capital Management"
433,Quora,$2,4/21/2017,United States,Mountain View,Internet software & services,"Y Combinator, Matrix Partners, Benchmark"
434,Improbable,$1,5/11/2017,United Kingdom,London,Other,"Andreessen Horowitz, SoftBank Group, Temasek Holdings"
435,Preferred Networks,$2,5/17/2018,Japan,Tokyo,Artificial intelligence,"Toyota Motor Corporation, Mizuho Financial Group, FANUC"
436,Formlabs,$2,8/1/2018,United States,Somerville,Hardware,"Pitango Venture Capital, DFJ Growth Fund, Foundry Group"
437,4Paradigm,$2,12/19/2018,China,Beijing,Artificial intelligence,"Sequoia Capital China, China Construction Bank, Bank of China"
438,Calm,$2,2/6/2019,United States,San Francisco,Consumer & retail,"Insight Venture Partners, TPG Growth, Sound Ventures"
439,Kaseya,$2,3/27/2019,United States,Miami,Cybersecurity,"Insight Partners, TPG Alternative & Renewable Technologies, Ireland Strategic Investment Fund"
440,Mafengwo,$2,5/23/2019,China,Beijing,Travel,"Qiming Venture Partners, Capital Today, General Atlantic"
441,Druva,$2,6/20/2019,United States,Sunnyvale,Data management & analytics,"Nexus Venture Partners, Tenaya Capital, Sequoia Capital"
442,Kujiale,$2,10/25/2019,China,Hangzhou,Internet software & services,"GGV Capital, IDG Capital, Linear Venture"
443,AppsFlyer,$2,1/21/2020,United States,San Francisco,Mobile & telecommunications,"Magma Venture Partners, Pitango Venture Capital, Qumra Capital"
444,Keep,$2,5/19/2020,China,Beijing,Mobile & telecommunications,"Bertelsmann Asia Investments, GGV Capital, Morningside Venture Capital"
445,Redis Labs,$2,8/25/2020,United States,Mountain View,Data management & analytics,"Viola Ventures, Dell Technologies Capital, Bain Capital Ventures"
446,Xingyun Group,$2,9/24/2020,China,Shenzhen,E-commerce & direct-to-consumer,"Matrix Partners China, Eastern Bell Capital, Hongtai Capital Holdings"
447,Unqork,$2,10/6/2020,United States,New York,Fintech,"Blackrock, capitalG, World Lab Innovation"
448,Virta Health,$2,12/2/2020,United States,San Francisco,Health,"Caffeinated Capital, Obvious Ventures, Venrock"
449,ISN,$2,12/17/2020,United States,Dallas,"Supply chain, logistics, & delivery",Blackstone
450,Earnix,$2,2/21/2021,Israel,Giv'atayim,Fintech,"Jerusalem Venture Partners, Israel Growth Partners, Insight Partners"
451,Guoquan Shihui,$2,3/17/2021,China,Shanghai,Consumer & retail,"Tiantu Capital, CMB International Capital, Vision Knight Capital"
452,Clearco,$2,4/20/2021,Canada,Toronto,Fintech,"Highland Capital Partners, Oak HC/FT Partners, Emergence Capital Partners"
453,Hive,$2,4/21/2021,United States,San Francisco,Artificial intelligence,"Tomales Bay Capital, Bain & Company, General Catalyst"
454,KRY,$2,4/27/2021,Sweden,Stockholm,Health,"Index Ventures, Creandum, Accel"
455,Kajabi,$2,5/4/2021,United States,Irvine,Internet software & services,"Meritech Capital Partners, Tiger Global Management, Spectrum Equity"
456,Ethos,$2.7,5/11/2021,United States,San Francisco,Fintech,"Sequoia Capital, Google Ventures, Accel"
457,PayFit,$2.1,1/6/2022,United Kingdom,London,Fintech,"Accel, frst, Kima Ventures"
458,Beisen,$2,5/11/2021,China,Beijing,Internet software & services,"Matrix Partners China, Sequoia Capital China, Genesis Capital"
459,Pipe,$2,5/19/2021,United States,Miami,Fintech,"next47, MaC Venture Capital, FinVC"
460,Iterable,$2,6/15/2021,United States,San Francisco,Internet software & services,"CRV, Blue Cloud Ventures, Index Ventures"
461,Bunq,$2,6/18/2021,Netherlands,Amsterdam,Fintech,Undisclosed
462,Clip,$2,6/10/2021,Mexico,Mexico City,Fintech,"Alta Ventures Mexico, General Atlantic, SoftBank Group"
463,Loggi,$2,6/5/2019,Brazil,Sao Paulo,"Supply chain, logistics, & delivery","Qualcomm Ventures, SoftBank Group. Monashees+"
464,MURAL,$2,7/20/2021,United States,San Francisco,Internet software & services,"Insight Partners, Tiger Global Management, Gradient Ventures"
465,Pagaya,$2,6/17/2020,Israel,Tel Aviv,Fintech,"Oak HC/FT Partners, GF Investments, Harvey Golub Family Office"
466,OCSiAl,$2,3/4/2019,Luxembourg,Leudelange,Other,"A&NN, Rusnano"
467,XtalPi,$2,8/11/2021,China,Shenzhen,Artificial intelligence,"Tencent Holdings, 5Y Capital, Sequoia Capital China"
468,Divvy Homes,$2,8/13/2021,United States,San Francisco,Fintech,"Andreessen Horowitz, Caffeinated Capital, SciFi VC"
469,Apeel Sciences,$2,5/26/2020,United States,Goleta,Other,"Upfront Ventures, Tao Capital Partners, Andreessen Horowitz"
470,Opay,$2,8/23/2021,Nigeria,Lagos,Fintech,"Sequoia Capital China, Source Code Capital, Redpoint Ventures China"
471,Aviatrix,$2,9/8/2021,United States,Santa Clara,Internet software & services,"Ignition Partners, Formation 8, CRV"
472,SmartNews,$2,8/5/2019,Japan,Tokyo,Mobile & telecommunications,"Japan Post Capital, Globis Capital Partners, Atomico"
473,Misfits Market,$2,4/21/2021,United States,Pennsauken,E-commerce & direct-to-consumer,"Accel, D1 Capita Partners, Greenoaks Capital Management"
474,Spring Health,$2,9/16/2021,United States,New York,Health,"Rethink Impact, Work-Bench, RRE Ventures"
475,Black Sesame Technologies,$2,9/22/2021,China,Shanghai,Artificial intelligence,"Northern Light Venture Capital, Xiaomi, FutureX Capital"
476,Advance Intelligence Group,$2,9/23/2021,Singapore,,Artificial intelligence,"Vision Plus Capital, GSR Ventures, ZhenFund"
477,Modern Treasury,$2,10/6/2021,United States,San Francisco,Fintech,"Benchmark, Altimeter Capital, Quiet Capital"
478,Magic Leap,$2,10/21/2014,United States,Plantation,Hardware,"Obvious Ventures, Qualcomm Ventures, Andreessen Horowitz"
479,Tier,$2,10/25/2021,Germany,Berlin,Travel,"Northzone Ventures, White Star Capital, Novator Partners"
480,ClickHouse,$2,10/28/2021,United States,Portola Valley,Data management & analytics,"Lightspeed Venture Partners, Almaz Capital Partners, Altimeter Capital"
481,Mynt,$2,11/1/2021,Philippines,Taguig City,Fintech,"Insight Partners, Warburg Pincus, Ayala Corporation"
482,Everlaw,$2,3/10/2020,United States,Oakland,Internet software & services,"K9 Ventures, Menlo Ventures, Andreessen Horowitz"
483,Zilch,$2,11/10/2021,United Kingdom,London,Fintech,"Gauss Ventures, Ventura Capital, dmg ventures"
484,VerbIT,$2,6/8/2021,United States,New York,Artificial intelligence,"ClalTech, Vertex Ventures, Oryzn Capital"
485,StarkWare,$8,11/17/2021,Israel,Netanya,Cybersecurity,"Sequoia Capital, Paradigm, Pantera Capital"
486,Netlify,$2,11/17/2021,United States,San Francisco,Internet software & services,"Andreessen Horowitz, Kleiner Perkins Caufield & Byers, EQT Ventures"
487,SWORD Health,$2,11/22/2021,United States,New York,Health,"Khosla Ventures, Green Innovations, Founders Fund"
488,LTK,$2,11/22/2021,United States,Dallas,Internet software & services,"SoftBank Group, Maverick Capital"
489,Trax,$2,7/22/2019,Singapore,,Artificial intelligence,"Hopu Investment Management, Boyu Capital, DC Thomson Ventures"
490,Exotec,$2,1/17/2022,France,Croix,Hardware,"Breega Capital, Iris Capital, 360 Capital Partners"
491,Dremio,$2,1/6/2021,United States,Santa Clara,Data management & analytics,"Lightspeed Venture Partners, Redpoint Ventures, Norwest Venture Partners"
492,Akulaku,$2,2/15/2022,Indonesia,Jakarta,E-commerce & direct-to-consumer,"DCM Ventures, IDG Capital, Siam Commercial Bank"
493,Cloudinary,$2,2/15/2022,United States,Santa Clara,Internet software & services,"Blackstone, Bessemer Venture Partners"
494,Lunar,$2,7/12/2021,Denmark,Aarhus,Fintech,"SEED Capital, Greyhound Capital, Socii Capital"
495,UpGrad,$2,8/9/2021,India,Mumbai,Edtech,"Qualcomm Ventures, Accel, Canaan Partners"
496,Salsify,$2,4/13/2022,United States,Boston,Internet software & services,"Matrix Partners, North Bridge Venture Partners, Venrock"
497,CertiK,$2,3/31/2022,United States,New York,Cybersecurity,"Tiger Global Management, Lightspeed Venture Partners, Hillhouse Capital Management"
498,ROX Motor,$2,4/29/2022,China,Shanghai,Auto & transportation,"Sequoia Capital China, IDG Capital, Qiming Venture Partners"
499,Hugging Face,$2,5/9/2022,United States,New York,Artificial intelligence,"Betaworks Ventures, Addition, Lux Capital"
500,Devo Technology,$2,10/26/2021,United States,Cambridge,Data management & analytics,"Insight Partners, Kibo Ventures, Bessemer Venture Partners"
501,Rimac Automobili,$2,6/1/2022,Croatia,Sveta Nedelja,Auto & transportation,"Porsche, InvestIndustrial, SoftBank Group"
502,Ankorstore,$1.98,1/10/2022,France,Paris,E-commerce & direct-to-consumer,"Global Founders Capital, Aglae Ventures, Alven Capital"
503,Fenbi Education,$1.95,2/7/2021,China,Beijing,Edtech,"Trustbridge Partners, Hony Capital, IDG Capital"
504,Rokt,$1.95,12/16/2021,United States,New York,Internet software & services,"Square Peg Capital, TDM Growth Partners, Tiger Global Management"
505,InVision,$1.9,11/1/2017,United States,New York,Internet software & services,"FirstMark Capital, Tiger Global Management, ICONIQ Capital"
506,eDaili,$1.9,2/1/2019,China,Shanghai,E-commerce & direct-to-consumer,"K2VC, Lightspeed China Partners, Sky9 Capital"
507,MX Technologies,$1.9,1/13/2021,United States,Lehi,Fintech,"Point72 Ventures, Pelion Venture Partners, Commerce Ventures"
508,Aledade,$1.9,1/19/2021,United States,Bethesda,Health,"Venrock, CVF Capital Partners, ARCH Venture Partners"
509,CoinSwitch Kuber,$1.9,10/6/2021,India,Bangalore,Fintech,"Tiger Global Management, Sequoia Capital India, Ribbit Capital"
510,Acorns,$1.9,3/9/2022,United States,Irvine,Fintech,"e.ventures, Bain Capital Ventures, Greycroft"
511,Roofstock,$1.94,3/10/2022,United States,Oakland,Fintech,"Khosla Ventures, Bain Capital Ventures, Lightspeed Venture Partners"
512,thatgamecompany,$1.94,3/3/2022,United States,Los Angeles,Internet software & services,"Benchmark, Sequoia Capital, TPG Capital"
513,ConcertAI,$1.9,3/29/2022,United States,Boston,Artificial Intelligence,"Sixth Street Partners, Declaration Partners, Maverick Ventures Israel"
514,Material Bank,$1.9,5/6/2022,United States,Boca Raton,E-commerce & direct-to-consumer,"Bain Capital Ventures, SoftBank Group, Fifth Wall Ventures"
515,Volocopter,$1.87,3/4/2022,Germany,Bruchsal,Auto & transportation,"btov Partners, Geely, Intel Capital"
516,ENOVATE,$1.85,4/15/2019,China,Shanghai,Auto & transportation,Automobile Industry Guidance Fund
517,CFGI,$1.85,9/15/2021,United States,Boston,Fintech,"The Carlyle Group, CVC Capital Partners"
518,Retool,$1.85,12/22/2021,United States,San Francisco,Internet software & services,Sequoia Capital
519,ZocDoc,$1.8,8/20/2015,United States,New York,Health,"Founders Fund, Khosla Ventures, Goldman Sachs"
520,Diamond Foundry,$1.8,3/29/2021,United States,San Francisco,Other,"Fashion Tech Lab, Fidelity Investments, Vast Ventures"
521,FullStory,$1.8,8/4/2021,United States,Atlanta,Internet software & services,"Google Ventures, Kleiner Perkins Caufield & Byers, Stripes Group"
522,Lightricks,$1.8,7/31/2019,Israel,Jerusalem,Artificial intelligence,"Viola Ventures, Insight Partners, ClalTech, Goldman Sachs"
523,Opentrons,$1.8,9/23/2021,United States,New York,Hardware,"SOSV, Khosla Ventures, Lerer Hippeau"
524,Slice,$1.8,11/28/2021,India,Bengaluru,Fintech,"Gunosy Capital, Blume Ventures, Das Capital"
525,Cambrian BioPharma,$1.79,10/26/2021,United States,Brooklyn,Health,"Future Ventures, Apeiron Investment Group, Moore Capital Management"
526,AIWAYS,$1.78,4/16/2018,China,Shanghai,Auto & transportation,"Jiangsu Sha Steel Group, Shanghai Puyin Industry, Funa Yuanchuang Technology"
527,Trulioo,$1.75,6/7/2021,Canada,Vancouver,Cybersecurity,"Blumberg Capital, American Express Ventures, BDC Venture Capital"
528,Spinny,$1.75,11/24/2021,India,Gurugram,E-commerce & direct-to-consumer,"General Catalyst, Eleation Capital, Avenir Growth Capital"
529,Crusoe,$1.75,4/21/2022,United States,Denver,Internet software & services,"Bain Capital Ventures, Founders Fund, Winklevoss Capital"
530,Orca Security,$1.8,3/23/2021,United States,Portland,Cybersecurity,"YL Ventures, Redpoint Ventures, GGV Capital"
531,Apus Group,$1.73,1/16/2015,China,Beijing,Mobile & telecommunications,"Redpoint Ventures, QiMing Venture Partners, Chengwei Capital"
532,Harry's,$1.7,2/16/2018,United States,New York,Consumer & retail,"Thrive Capital, Tiger Global Management, Temasek"
533,PAX,$1.7,10/22/2018,United States,San Francisco,Consumer & retail,"Tao Capital Partners, Global Asset Capital, Tiger Global Management"
534,DispatchHealth,$1.7,3/3/2021,United States,Denver,Health,"Alta Partners, Questa Capital, Echo Health Ventures"
535,Saliogen Therapeutics,$1.7,12/7/2021,United States,Cambridge,Health,"PBM Capital Group, T. Rowe Price, D1 Capital Partners"
536,Pax8,$1.7,4/11/2022,United States,Greenwood Village,Internet software & services,"Liberty Global Ventures, Sageview Capital, Blue Cloud Ventures"
537,Multiverse,$1.7,6/8/2022,United Kingdom,London,Edtech,"Lightspeed Venture Partners, Google Ventures, General Catalyst"
538,Tessera Therapeutics,$1.69,4/19/2022,United States,Cambridge,Health,"Altitude Life Science Ventures, SoftBank Group, Alaska Permanent Fund"
539,Unite Us,$1.6,3/16/2021,United States,New York,Health,"Insight Partners, Sequoia Capital, Index Ventures"
540,CircleCI,$1.7,5/11/2021,United States,San Francisco,Internet software & services,"Threshold Ventures, Baseline Ventures, Harrison Metal"
541,Wave,$1.7,9/7/2021,Senegal,Dakar,Fintech,"Stripe, Founders Fund, Partech Partners"
542,Vestiaire Collective,$1.7,3/1/2021,France,Paris,E-commerce & direct-to-consumer,"Eurazeo, IDInvest Partners, Balderton Capital"
543,Dragos,$1.7,10/28/2021,United States,Hanover,Cybersecurity,"DataTribe, Energy Impact Partners, AllegisCyber Capital"
544,Reltio,$1.7,11/4/2021,United States,Redwood City,Data management & analytics,"Crosslink Capital, .406 Ventures, Sapphire Ventures"
545,H2O.ai,$1.7,11/7/2021,United States,Mountain View,Artificial intelligence,"Nexus Venture Partners, Transamerica Ventures, Crane Venture Partners"
546,ZenBusiness,$1.7,11/9/2021,United States,Austin,Fintech,"Greycroft, Lerer Hippeau, Geekdom Fund"
547,Carsome,$1.7,7/12/2021,Malaysia,Selangor,E-commerce & direct-to-consumer,"Gobi Partners, 500 Startups, Ondine Capital"
548,Productboard,$1.7,2/2/2022,United States,San Francisco,Internet software & services,"Index Ventures, Kleiner Perkins Caufield & Byers, Bessemer Venture Partners"
549,Spotter,$1.7,2/16/2022,United States,Los Angeles,Fintech,"SoftBank Group, Access Industries, Crossbeam Venture Partners"
550,Hibob,$1.65,10/12/2021,Israel,Tel Aviv,Internet software & services,"Bessemer Venture Partners, Eight Roads Ventures, Battery Ventures"
551,Optimism,$1.65,3/17/2022,United States,San Francisco,Internet software & services,"Paradigm, Huobi Ventures, Andreessen Horowitz"
552,Trader Interactive,$1.63,5/12/2021,United States,Norfolk,Other,Carsales
553,Jusfoun Big Data,$1.62,7/9/2018,China,Beijing,Data management & analytics,"Boxin Capital, DT Capital Partners, IDG Capital"
554,Transcarent,$1.62,1/11/2022,United States,San Francisco,Health,"Alta Partners, General Catalyst, Jove Equity Partners"
555,DealShare,$1.7,1/27/2022,India,Bengaluru,E-commerce & direct-to-consumer,"Alpha Wave Global, Matrix Partners India, Tiger Global Management"
556,Zhubajie,$1.61,6/16/2015,China,Chongqing,Internet software & services,"Cybernaut Growth Fund, IDG Capital"
557,solarisBank,$1.65,7/13/2021,Germany,Berlin,Fintech,"Yabeo Capital, SBI Investment, Vulcan Capital"
558,Infinidat,$1.6,4/29/2015,United States,Waltham,Hardware,"TPG Growth, Goldman Sachs"
559,Afiniti,$1.6,4/14/2017,Bermuda,Hamilton,Artificial intelligence,GAM Holding
560,Cao Cao Mobility,$1.6,1/17/2018,China,Hangzhou,Auto & transportation,"People Electrical Appliance Group China, Zhongrong International Trust"
561,Verkada,$1.6,1/29/2020,United States,San Mateo,Cybersecurity,"next47, First Round Capital, Sequoia Capital"
562,Clari,$2.6,3/3/2021,United States,Sunnyvale,Internet software & services,"Sequoia Capital, Bain Capital Ventures, enaya Capital"
563,Tonal,$1.6,3/31/2021,United States,San Francisco,E-commerce & direct-to-consumer,"Mayfield Fund, Shasta Ventures, L Catterton"
564,Clio,$1.6,4/27/2021,Canada,Burnaby,Internet software & services,"OMERS Private Equity, T. Rowe Price, Technology Crossover Ventures"
565,SafetyCulture,$1.6,5/3/2021,Australia,Sydney,Internet software & services,"Blackbird Ventures, IndexVentures, Tiger Global Management"
566,Monte Carlo,$1.6,5/24/2022,United States,San Francisco,Artificial intelligence,"GGV Capital, Accel, Redpoint Ventures"
567,Cresta,$1.6,3/17/2022,United States,San Francisco,Artificial Intelligence,"Andreessen Horowitz, Greylock Partners, Sequoia Capital"
568,Extend,$1.36,5/18/2021,United States,San Francisco,Fintech,"GreatPoint Ventures, Meritech Capital Partners, PayPal Ventures"
569,Generate Biomedicines,$1.36,11/18/2021,United States,Cambridge,Health,"Altitude Life Science Ventures. T. Rowe Price, Morningside Venture Partners"
570,Cognite,$1.5,5/19/2021,Norway,Lysaker,Data management & analytics,"Technology Crossover Ventures, Accel, Aker"
571,ASAPP,$1.6,5/19/2021,United States,New York,Artificial intelligence,"March Capital Partners, HOF Capital, Emergence Capital Partners"
572,SmartHR,$1.6,6/8/2021,Japan,Tokyo,Fintech,"BEENEXT, World Innovation Lab, Light Street Capital"
573,Mercury,$1.6,7/3/2021,United States,San Francisco,Fintech,"Andreessen Horowitz, Coatue Management, Clocktower Technology Ventures"
574,HomeLight,$1.6,9/2/2021,United States,San Francisco,Fintech,"Zeev Ventures, Menlo Ventures,Crosslink Capital"
575,Truepill,$1.6,10/27/2021,United States,Hayward,Health,"Initialized Capital, Sound Ventures, TI Platform Management"
576,ezCater,$1.6,4/2/2019,United States,Boston,"Supply chain, logistics, & delivery","Insight Venture Partners, ICONIQ Capital, Launchpad Venture Group"
577,Wayflyer,$1.6,2/1/2022,Ireland,Dublin,Fintech,"QED Investors, DST Global, Left Lane Capital"
578,Capitolis,$1.6,3/22/2022,United States,New York,Fintech,"Sequoia Capital, Index Ventures, S Capital"
579,Nord Security,$1.6,4/7/2022,Lithuania,Vilnius,Cybersecurity,"General Catalyst, BaltCap, Novator Partners"
580,Vanta,$1.6,6/7/2022,United States,San Francisco,Cybersecurity,"Craft Ventures, Sequoia Capital, Verissimo Ventures"
581,Promasidor Holdings,$1.59,11/8/2016,South Africa,Bryanston,Consumer & retail,"IFC, Ajinomoto"
582,ICON 3D,$1.57,2/18/2022,United States,Austin,Hardware,"Moderne Ventures, Oakhouse Partners, Bjarke Ingels Group"
583,Baiwang,$1.55,3/25/2019,China,Beijing,Fintech,"Guozhong Venture Capital Management, Shenzhen Capital Group, Oriental Fortune Capital"
584,Iluvatar CoreX,$1.55,3/1/2021,China,Shanghai,Hardware,"Centurium Capital, Cedarlake Capital, Unicom Innovation Venture Capital"
585,Wenheyou,$1.55,4/17/2021,China,Hunan,Other,"Sequoia Capital China, Warburg Pincus, IDG Capital"
586,Kitopi,$1.55,7/1/2021,United Arab Emirates,Dubai,"Supply chain, logistics, & delivery","CE-Ventures, BECO Capital, Nordstar"
587,Loom,$1.53,5/20/2021,United States,San Francisco,Internet software & services,"Kleiner Perkins Caufield & Byers, Sequoia Capital, General Catalyst"
588,Ximalaya FM,$1.52,9/22/2017,China,Shanghai,Mobile & telecommunications,"China Creation Ventures, Sierra Ventures, Xingwang Investment Management"
589,Carzone,$1.52,3/1/2019,China,Jiangsu,E-commerce & direct-to-consumer,"Alibaba Group,Co-Stone Venture Capital, Buhuo Venture Capital"
590,Mu Sigma,$1.5,2/7/2013,United States,Northbrook,Data management & analytics,"Sequoia Capital, General Atlantic"
591,Kushki,$1.5,6/7/2022,Ecuador,Quito,Fintech,"Clocktower Technology Ventures, DILA Capital, Kaszek Ventures"
592,TuJia,$1.5,6/17/2015,China,Beijing,Travel,"GGV Capital, QiMing Venture Partnersl"
593,Mofang Living,$1.5,4/13/2016,China,Shanghai,E-commerce & direct-to-consumer,"Warburg Pincus, Aviation Industry Corporation of China"
594,Gett,$1.5,5/24/2016,United Kingdom,London,Auto & transportation,"Volkswagen, Access Industries, Vostok New Ventures"
595,DT Dream,$1.5,6/8/2017,China,Hangzhou,Data management & analytics,"Alibaba Group, China Everbright Investment Management, Yinxinggu Capital"
596,Changingedu,$1.5,10/30/2017,China,Shanghai,Edtech,"Trustbridge Partners, IDG Capital, Sequoia Capital China"
597,XiaoZhu,$1.5,11/1/2017,China,Beijing,Travel,"Morningside Ventures, Capital Today, JOY Capital"
598,JOLLY Information Technology,$1.5,5/29/2018,China,Hangzhou,E-commerce & direct-to-consumer,"Legend Capital, CDH Investments, Sequoia Capital China"
599,Yijiupi,$1.5,9/20/2018,China,Beijing,Consumer & retail,"Source Code Capital, Meituan Dianping, Tencent Holdings"
600,Cambridge Mobile Telematics,$1.5,12/19/2018,United States,Cambridge,Mobile & telecommunications,SoftBank Group
601,Collective Health,$1.5,6/17/2019,United States,San Francisco,Fintech,"New Enterprise Associates, Founders Fund, Google Ventures"
602,Strava,$1.5,11/16/2020,United States,San Francisco,Internet software & services,"Jackson Square Ventures, Madrone Capital Partners, Sequoia Capital"
603,Zenoti,$1.5,12/15/2020,United States,Bellevue,Internet software & services,"Norwest Venture Partners, Accel, Tiger Global Management"
604,K Health,$1.5,1/19/2021,United States,New York,Health,"Max Ventures, Mangrove Capital Partners, 14W"
605,Uplight,$1.5,3/3/2021,United States,Boulder,Other,"Rubicon Technology Partners, Max Ventures, Inclusive Capital Partners"
606,ID.me,$1.5,3/19/2021,United States,McLean,Cybersecurity,"Moonshots Capital, BoxGroup, Blu Venture Investors"
607,Snapdocs,$1.5,5/25/2021,United States,San Francisco,Fintech,"Sequoia Capital, Y Combinator, F-Prime Capital"
608,Chipper Cash,$2,5/31/2021,United States,San Francisco,Fintech,"Deciens Capital, Bezos Expeditions, 500 Startups"
609,Ledger,$1.5,6/10/2021,France,Paris,Hardware,"Digital Currency Group, Draper Esprit, Korelya Capital"
610,Next Silicon,$1.5,6/14/2021,Israel,Tel Aviv,Hardware,"Amiti Ventures, Playground Global, Aleph"
611,YunQuNa,$1.5,6/29/2021,China,Shanghai,"Supply chain, logistics, & delivery","Source Code Capital, Coatue Management, DCM Ventures"
612,impact.com,$1.5,7/13/2021,United States,Santa Barbara,Internet software & services,"Redpoint Ventures, Providence Equity Partners, Silversmith Capital Partners"
613,SmartRecruiters,$1.5,7/20/2021,United States,San Francisco,Internet software & services,"Mayfield Fund, Insight Partners, Rembrandt Venture Partners"
614,NotCo,$1.5,7/26/2021,Chile,Santiago,Artificial Intelligence,"Kaszek Ventures, SOSV, Tiger Global Management"
615,Culture Amp,$1.5,7/29/2021,Australia,Richmond,Internet software & services,"Felicis Ventures, Index Ventures, Blackbird Ventures"
616,TaxBit,$1.5,8/4/2021,United States,Draper,Fintech,"Insight Partners, Coinbase Ventures, PayPal Ventures"
617,Pacaso,$1.5,3/24/2021,United States,Cincinnati,Fintech,"Global Founders Capital, Shea Ventures, Greycroft"
618,1047 Games,$1.5,9/14/2021,United States,Zephyr Cove,Internet software & services,"VGames, Lakestar, Galaxy Interactive"
619,Matillion,$1.5,9/15/2021,United Kingdom,Altrincham,Data management & analytics,"Scale Venture Partners, Sapphire Ventures, Battery Ventures"
620,Persona,$1.5,9/15/2021,United States,San Francisco,Cybersecurity,"Coatue Management, Index Ventures, Founders Fund"
621,Whatnot,$1.5,9/16/2021,United States,Marina del Rey,E-commerce & direct-to-consumer,"Y Combinator, Andreessen Horowitz, Wonder Ventures"
622,Ascend Money,$1.5,9/27/2021,Thailand,Bangkok,Fintech,"Ant Group, Charoen Pokphand Group, Bow Wave Capital"
623,Andela,$1.5,9/29/2021,United States,New York,Internet software & services,"Spark Capital, Google Ventures, CRE Venture Capital"
624,Built,$1.5,9/30/2021,United States,Nashville,Internet software & services,"Nyca Partners, Index Ventures, Technology Crossover Ventures"
625,candy.com,$1.5,10/21/2021,United States,New York,Fintech,"Insight Partners, Softbank Group, Connect Ventures"
626,CoinList,$1.5,10/15/2021,United States,San Francisco,Fintech,"Accomplice, Polychain Capital, GoldenTree Asset Management"
627,Lusha,$1.5,11/10/2021,United States,New York,Internet software & services,"PSG, ION Crossover Partners"
628,CureFit,$1.5,11/10/2021,India,Bengaluru,Health,"Chiratae Ventures, Accel, Kalaari Capital"
629,Solugen,$1.5,9/10/2021,United States,Houston,Other,"Fifty Years Fund, Refactor Capital, Temasek"
630,Olist,$1.5,12/15/2021,Brazil,Curitiba,E-commerce & direct-to-consumer,"Redpoint e.ventures, Valor Capital Group, SoftBank Latin America Fund"
631,Paradox,$1.5,12/27/2021,United States,Scottsdale,Internet software & services,"Brighton Park Capital, Blue Cloud Ventures, Workday Ventures"
632,Airbyte,$1.5,12/17/2021,United States,San Francisco,Internet software & services,"Accel, Benchmark, SV Angel"
633,StoreDot,$1.5,1/4/2022,Israel,Herzliya,Other,"Samsung Ventures, SingulariTeam, BP Ventures"
